{
  "v": 1,
  "id": "020-release-verification",
  "tdd": true,
  "dod": [
    "bun test",
    "bun run typecheck"
  ],
  "tasks": [
    {
      "id": "020-release-verification-1",
      "do": "Add tests for release webhook payload validation and jobId mapping to release-verification.",
      "verify": "bun test -- webhook validation tests fail before implementation."
    },
    {
      "id": "020-release-verification-2",
      "do": "Implement release webhook handler mapping to release-verification pipeline.",
      "verify": "bun test -- webhook handler tests pass."
    },
    {
      "id": "020-release-verification-3",
      "do": "Add tests for security analysis output (score, high/medium findings, PDF metadata).",
      "verify": "bun test -- security analysis tests fail before implementation."
    },
    {
      "id": "020-release-verification-4",
      "do": "Implement Trail of Bits Skills prompt-based analysis and A4 PDF generation.",
      "verify": "bun test -- security analysis tests pass."
    },
    {
      "id": "020-release-verification-5",
      "do": "Add tests for backwards compatibility scoring and blockers/high-risk lists.",
      "verify": "bun test -- compatibility tests fail before implementation."
    },
    {
      "id": "020-release-verification-6",
      "do": "Implement compatibility scoring and classification logic.",
      "verify": "bun test -- compatibility tests pass."
    },
    {
      "id": "020-release-verification-7",
      "do": "Add tests for reproducible build verification via Ralph/CLI and hash recording.",
      "verify": "bun test -- reproducible build tests fail before implementation."
    },
    {
      "id": "020-release-verification-8",
      "do": "Implement reproducible build verification and set Freigabe to Manuelle Pr\u00fcfung on failure.",
      "verify": "bun test -- reproducible build tests pass."
    },
    {
      "id": "020-release-verification-9",
      "do": "Add tests for JSON report shape and reviewer loop requirements (5/4, max 3).",
      "verify": "bun test -- report and reviewer tests fail before implementation."
    },
    {
      "id": "020-release-verification-10",
      "do": "Implement report assembly, reviewer loop, and Freigabe decision output.",
      "verify": "bun test -- report and reviewer tests pass."
    },
    {
      "id": "020-release-verification-11",
      "do": "Add tests for S3 PDF storage (URL + SHA-256) and email delivery with attachment.",
      "verify": "bun test -- storage and email tests fail before implementation."
    },
    {
      "id": "020-release-verification-12",
      "do": "Implement S3 storage integration and SMTP email delivery using Effect DI.",
      "verify": "bun test -- storage and email tests pass."
    }
  ]
}
