{
  "v": 1,
  "id": "000-base",
  "tdd": true,
  "dod": [
    "bun test",
    "bun run typecheck"
  ],
  "tasks": [
    {
      "id": "000-base-1",
      "do": "Add tests for GET /_health returning {\"status\":\"ok\"} and proper status codes.",
      "verify": "bun test -- tests for health endpoint fail before implementation."
    },
    {
      "id": "000-base-2",
      "do": "Implement GET /_health endpoint with JSON response.",
      "verify": "bun test -- health endpoint tests pass."
    },
    {
      "id": "000-base-3",
      "do": "Add tests for POST /webhook validation, auth (when WEBHOOK_SECRET set), and 202 accepted response.",
      "verify": "bun test -- webhook validation/auth tests fail before implementation."
    },
    {
      "id": "000-base-4",
      "do": "Implement POST /webhook with async trigger, auth check, and status responses.",
      "verify": "bun test -- webhook tests pass."
    },
    {
      "id": "000-base-5",
      "do": "Add tests for Task Runner behavior: unknown jobId error, ok/error payload shape, and idempotency on GitHub delivery id.",
      "verify": "bun test -- task runner tests fail before implementation."
    },
    {
      "id": "000-base-6",
      "do": "Implement Task Runner with jobId dispatch, result shape, idempotency window, and async execution wiring.",
      "verify": "bun test -- task runner tests pass."
    },
    {
      "id": "000-base-7",
      "do": "Add tests for run store persistence (sqlite default) and retention policy handling.",
      "verify": "bun test -- run store tests fail before implementation."
    },
    {
      "id": "000-base-8",
      "do": "Implement run store with SQLite default, retention cleanup, and Effect DI wiring.",
      "verify": "bun test -- run store tests pass."
    },
    {
      "id": "000-base-9",
      "do": "Add tests for cron scheduler with Effect Cron mapping jobId and retry policy.",
      "verify": "bun test -- cron scheduler tests fail before implementation."
    },
    {
      "id": "000-base-10",
      "do": "Implement cron scheduler wiring with retry policy and Effect DI.",
      "verify": "bun test -- cron scheduler tests pass."
    },
    {
      "id": "000-base-11",
      "do": "Add tests for observability integrations: structured logging, OTEL tracing export, and Sentry capture on failure.",
      "verify": "bun test -- observability tests fail before implementation."
    },
    {
      "id": "000-base-12",
      "do": "Implement observability adapters (logs, OTEL, Sentry) via Effect DI and ensure task failures are captured.",
      "verify": "bun test -- observability tests pass."
    },
    {
      "id": "000-base-13",
      "do": "Add tests for configuration env handling and defaults.",
      "verify": "bun test -- config tests fail before implementation."
    },
    {
      "id": "000-base-14",
      "do": "Implement configuration loader with defaults and validation.",
      "verify": "bun test -- config tests pass."
    }
  ]
}
